<?xml version="1.0" encoding="UTF-8"?>
<weapons xmlns:xsi="http://www.w3.org/2001/XMLSchema-instance" xmlns="http://www.vsu.by/weapons" xsi:schemaLocation="http://www.vsu.by/weapons weapons.xsd">
<weapon id="2">
<Type>DAGGER</Type>
<Handy>TWO_HANDED</Handy>
<Origin>Second</Origin>
<Visual><bladeMaterial>CAST IRON</bladeMaterial>
<bloodstream>true</bloodstream>
<bladeLength>22</bladeLength>
<bladeWidth>12</bladeWidth>
<handleMaterial>PLASTIC</handleMaterial>
</Visual>
<Value>false</Value>
</weapon>
<weapon id="1">
<Type>KNIFE</Type>
<Handy>ONE_HANDED</Handy>
<Origin>First</Origin>
<Visual><handleMaterial>METAL</handleMaterial>
<bladeLength>32</bladeLength>
<bladeMaterial>STEEL</bladeMaterial>
<bloodstream>false</bloodstream>
<bladeWidth>22</bladeWidth>
</Visual>
<Value>true</Value>
</weapon>
</weapons>
